Judul,Abstrak,Tanggal,Author,Jurnal,cluster
Implementasi Data Warehouse Menggunakan Pentaho BI di Hartaning House Homestay,"Hartaning House is one of the homestays in Ubud Gianyar that rents out homestay rooms to foreign and local tourists, but currently does not have a data-based system that facilitates business reports. This research aims to provide a proposed solution in the form of designing and implementing data related to room rental, to facilitate the determination of the promotion of equal distribution of all homestay rooms. The implementation will use an open source application, namely (Pentaho Business Intelligence) for making reports that are used to facilitate analysis. The data is made in a multi-dimensional design to facilitate the application of the data warehouse design and system designs that have been made.",Publish Date 31 Aug 2021,"Sidi, Widya Dharma","JELIKU (Jurnal Elektronik Ilmu Komputer Udayana) Vol 10 No 1 (2021): JELIKU Volume 10 No 1, Agustus 2021",0
Implementasi Data Warehouse Dan Penerapannya Pada PHI-Minimart Dengan Menggunakan Tools Pentaho dan Power BI,"A shop owner needs an information system to see sales conditions. However, PHI Minimart only provides sales information that is stored in a database so that it cannot provide or present information quickly. To solve this problem, a data warehouse was built at PHI Mart to get fast information. This research will carry out the implementation of data warehouse sales from data sources, the extraction, transformation, loading (ETL) process using Pentaho tools, making Starschema in the form of branch dimensions, product dimensions, employee dimensions, time dimensions connected to the sales fact table, dashboard using BI power. Then the results of the data warehouse are analyzed through the OLAP (On-line Analytical Processing) process, making a cube or schema workbench, and making a dashboard for visualization in presenting the expected information from PHI Minimart. The results in this study include sales data used in 2008 in the form of sales graphs or dashboards, goods sold, and total sales of each branch, which are obtained as the delivery of sales information at the store.",Publish Date 31 Aug 2021,"Arta Wibawa, I Gede","JELIKU (Jurnal Elektronik Ilmu Komputer Udayana) Vol 10 No 1 (2021): JELIKU Volume 10 No 1, Agustus 2021",12
Perancangan dan Implementasi Data Warehouse Penjualan (Studi Kasus: Northwind Sample Database),"Complex analysis is essential for corporate decision-making. The data warehouse is considered more effective to support the analysis process, design, and business decision-making. Usually, a company will build a data warehouse to store operational data that is useful in the business analysis process, so the information that the company wants can be prevalent more easily. The study will arrange a design and implementation of the data warehouse, which uses the Northwind database as its source. For the warehouse data storage, a nine-step design technique and the purification software are used to implementing the process. The design and implementation will form a sales fact chart containing information that use to help the company's business analyses and decisions, which in this study is visualized using a Microsoft Power Business Intelligence application.",Publish Date 31 Aug 2021,"Abimanyu, Cokorda Gde","JELIKU (Jurnal Elektronik Ilmu Komputer Udayana) Vol 10 No 1 (2021): JELIKU Volume 10 No 1, Agustus 2021",13
Implementasi Metode Gaussian dan Median Filtering dalam Penghilangan Noise pada Citra,"Meningkatnya angka kriminalitas menjadikan salah satu faktor dipasangnya CCTV pada beberapa sudut area oleh beberapa lembaga sebagai bentuk pengawasan, salah satunya yang telah dilakukan oleh Kementerian Perhubungan Republik Indonesia. Pengawasan melalui CCTV sering kali menghadapi gangguan, seperti hasil citra ber-noise yang menghambat proses pengidentifikasian suatu objek yang tertangkap CCTV. Oleh karena itu, penulis mencoba untuk melakukan implementasi metode Gaussian Filtering dan Median Filtering sebagai upaya dalam menghilangkan noise pada citra yang dihasilkan oleh CCTV. Implementasi yang akan dilakukan pada penelitian ini diawali dengan melakukan input data yang berupa citra hasil screen capture CCTV, kemudan dilakukan konversi dari citra berwarna menjadi citra greyscale. Tahap selanjutnya adalah melakukan penghilangan noise menggunakan metode Gaussian Filtering dan Median Filtering. Mean Square Error (MSE) dan Peak Signal to Noise Ratio (PSNR) digunakan dalam pengujian. Dapat disimpulkan dari penelitian ini, Median Filtering lebih efektif dalam melakukan penghilangan noise dari pada Gaussian Filtering. Hal ini dibuktikan dari 20 percobaan penghilangan noise menggunakan Median Filtering, 80% citra yang diproses menghasilkan nilai PSNR yang lebih besar daripada nilai PSNR citra dengan noise dan mengartikan jika citra yang diproses mendekati citra asli (citra tanpa noise). Sedangkan dari dari 20 percobaan penghilangan noise menggunakan Gaussian Filtering hanya 50% citra yang diproses menghasilkan nilai PSNR yang lebih besar daripada nilai PSNR citra dengan noise. Selanjutnya, untuk nilai standar deviasi terbaik penghilangan noise pada citra adalah ketika ada pada nilai 2 dengan rerata persentase penurunan noise sebesar 1,73%. Kata Kunci: CCTV, Citra, Pengolahan Citra, Noise, Gaussian Filtering, Median Filtering.",Publish Date 04 Jan 2022,"Sanjaya ER, Ngurah Agus","JELIKU (Jurnal Elektronik Ilmu Komputer Udayana) Vol 10 No 2 (2021): JELIKU Volume 10 No 2, November 2021",3
Pengamanan Lontar Digital Dengan Tanda Tangan Digital Menggunakan Algoritma RSA,"Lontar is a relic of cultural heritage whose basic source of manufacture is from rontal or tal leaves containing evidence of all records of aspects of ancient historical life which include historical values, religion, philosophy, medicine, literature and other sciences so that their sustainability needs to be maintained. Security of digital lontar will make it easier to preserve a lontar work so that it is not changed or falsified by irresponsible parties, where digital lontar in PDF format will be given a digital signature to maintain the authenticity of the document. Documents that are signed will be difficult for other parties to change, if the contents of a digital ejection are changed it will cause the digital signature to change. Based on the research conducted, from the results of testing the security of digital ejection with digital signatures using the RSA algorithm, the test results from RMSE (Root Mean Square Error) for description results with an average of 69.7794143. The larger or random the description results, the more complex the description results will be.",Publish Date 04 Jan 2022,"Alit Indrawan, I Gusti Ngurah","JELIKU (Jurnal Elektronik Ilmu Komputer Udayana) Vol 10 No 2 (2021): JELIKU Volume 10 No 2, November 2021",9
Segmentasi Baris Aksara Bali Pada Citra Lontar,"Indonesia merupakan negara kepulauan yang disetiap pulaunya memiliki kebudayaan yang berbeda-beda, seperti misalnya Pulau Bali yang sangat kaya akan warisan budaya, salah satunya yaitu aksara Bali. Aksara Bali merupakan lambang bahasa masyarakat Bali yang sampai saat ini masih digunakan. Salah satu media yang dimanfaatkan untuk menuliskan aksara Bali yaitu lontar dapat mengalami penurunan kualitas dikarenakan usia yang semakin tua. Hal tersebut tentunya berpengaruh terhadap tulisan aksara Bali yang terdapat pada lontar, sehingga menyulitkan pembaca untuk mengetahui informasi yang terkandung pada lontar tersebut. Upaya yang dapat dilakukan untuk menyelamatkan informasi yang terkandung pada lontar adalah dengan mengubahnya kedalam bentuk digital. Tulisan aksara Bali pada lontar terkadang memiliki jarak yang dekat antar baris aksara sehingga karakter aksara pada baris satu dengan karakter aksara pada baris lainnya bersentuhan. Aksara yang bersentuhan juga dapat menyulitkan pembaca memahami makna dari tulisan tersebut. Aksara yang paling sering bersentuhan adalah gantungan pada kasara baris atas dengan pengangge pada baris aksara dibawahnya. Oleh karena itu, diperlukan segmentasi baris untuk menemukan dan memperjelas baris pemisah antara aksara pada baris satu dengan aksara pada baris lainnya. Proses segmentasi baris aksara Bali dilakukan menggunakan Algoritma Genetika. Algoritma Genetika akan mencari kromosom dengan nilai fitness terbaik. Gen pada kromosom tersebut mewakili baris piksel citra biner yang diambil secara acak sesuai batas area segmentasi. Berdasarkan hasil pengujian yang telah dilakukan terhadap 10 bilah citra lontar, diperoleh hasil akurasi proses segmentasi baris aksara Bali menggunakan Algoritma Genetika adalah sebesar 92.17%.",Publish Date 04 Jan 2022,"Widiartha, I Made","JELIKU (Jurnal Elektronik Ilmu Komputer Udayana) Vol 10 No 2 (2021): JELIKU Volume 10 No 2, November 2021",11
IDENTIFICATION OF HOAX BASED ON TEXT MINING USING K-NEAREST NEIGHBOR METHOD,"At this time, information is very easy to obtain, information can spread quickly to all corners of society. However, the information that spreaded are not all true, there is false information or what is commonly called hoax which of course is also easily spread by the public, the public only thinks that all the information circulating on the internet is true. From every news published on the internet, it cannot be known directly that the news is a hoax or valid one. The test uses 740 random contents / issue data that has been verified by an institution, where 370 contents are hoaxes and 370 contents are valid. The test uses the K-Nearest Neighbor algorithm, before the classification process is performed, the preprocessing stage is performed first and uses the TF-IDF equation to get the weight of each feature, then classified using K-Nearest Neighbor and the test results is evaluated using 10-Fold Cross Validation. The test uses the k value with a value of 2 to 10. The optimal use of the k value in the implementation is obtained at a value of k = 4 with precision, recall, and F-Measure results of 0.764856, 0.757583, and 0.751944 respectively and an accuracy of 75.4%",Publish Date 04 Jan 2022,"Safira, Maria Okta","JELIKU (Jurnal Elektronik Ilmu Komputer Udayana) Vol 10 No 2 (2021): JELIKU Volume 10 No 2, November 2021",4
SISTEM REKOMENDASI TEMPAT WISATA MENGGUNAKAN ALGORITMA CHEAPEST INSERTION HEURISTIC DAN NAÏVE BAYES,"Bali merupakan salah satu daerah pariwisata terbaik di Indonesia, terbukti pada tahun 2016 Bali menerima sejumlah penghargaan pada TripAdvisor Travellers Choice Award dalam lingkup global dan Asia. Namun adanya wabah virus Corona dari tahun 2019, menyebabkan sektor pariwisata di bali menjadi menurun, dengan demikian dibutuhkan solusi untuk memulihakan sektor pariwisata yang ada di bali, dimana salah satu solusinya adalah dengan mengangkat wisata budaya dengan lebih maksimal, sebagai daya tarik utama destinasi wisata di bali. Maka penulis mengajukan Sistem Rekomendasi wisata, yang bertujuan untuk merekomendasikan tempat wisata yang sesuai dengan wisatawan, yang dalam sistem rekomendasi ini direkomendasikan juga destinasi wisata budaya yang langsung direkomendasikan oleh masyarakat, dan terdapat juga pemetaan tempat wisata sebagai bagian dari sistem rekomendasi wisata, pemetaan tempat wisata umum dan tempat wisata budaya . Pada sistem rekomendasi wisata ini, menggunkaan Algoritma Naïve Bayes untuk merekomendasikan destinasi wisata umum berdasarkan motivasi personal wisatawan, yang berdasarkan atribut umur, jenis kelamin, minat alam, minat buatan, minat budaya wisatawan, dengan menggunakan 200 data training yang terdiri dari 14 class tempat wisata . Selain itu sistem rekomendasi wisata ini dilengkapi dengan rekomendasi perutean tempat wisata menggunakan Algoritma Cheapest Insertion Heuristic, untuk mengatur list rute tempat wisata Kata Kunci : Sistem Rekomendasi, Algoritma Naïve Bayes, Algoritma Cheapest Insertion Heuristi, Motivasi Personal, Pemetaan Tempat.",Publish Date 04 Jan 2022,"Ari Mogi, I Komang","JELIKU (Jurnal Elektronik Ilmu Komputer Udayana) Vol 10 No 2 (2021): JELIKU Volume 10 No 2, November 2021",11
"PENGEMBANGAN SISTEM REKOMENDASI PENEMPATAN PRODUK SOVENIR LOKAL BALI BERDASARKAN ALGORITMA APRIORI STUDI KASUS : PASAR SENI UBUD GIANYAR, BALI","COVID-19 membawa dampak buruk bagi sektor pendapatan masyarakat Ubud khususnya para penjual souvenir karena menurunnya kedatangan wisatawan. Pemulihan perekonomian masyarakat Ubud khususnya pemasaran souvenir harus memperbaiki beberapa aspek agar mampu menentukan strategi penjualan optimal, sehingga solusi pada penelitian ini adalah pengembangan sistem aplikasi berbasis mobile menyesuaikan kebutuhan penjual souvenir untuk mengembangkan strategi pemasaran pasca COVID-19, aplikasi ini menggunakan implementasi Algoritma Apriori sebagai keluaran rekomendasi berupa pola asosiasi dari transaksi sehingga mendapatkan suatu rules/aturan. Aplikasi dikembangkan secara Hybrid Multiplatform, front-end menggunakan Kotlin Multiplatform Mobile dan Webview, sedangkan back-end menggunakan PHP dan Database MySql. Berdasarkan Evaluasi Aturan Asosiasi dengan tools WEKA menggunakan 25 transaksi dan set minimum support sebesar 0,1 atau 10%, aturan asosiasi sistem sama dengan aturan/rules yang dihasilkan aplikasi WEKA dengan total 42 jumlah aturan asosiasi dengan parameter tertinggi confidence 0,75 dan lift ratio 2,34. Dari hasil pengujian black box, semua fungsional yang ada aplikasi rekomendasi ini telah berhasil berjalan sebagaimana seharusnya dengan persentase keberhasilan 98% di 8 (delapan) platform Android 4 sampai android 11, dan hasil analisis kepuasan pengguna dengan skala likert sebanyak 30 responden rata-rata 86,4% pengguna sangat puas dengan keseluruhan proses sistem. Kata Kunci: Aplikasi Mobile, Data Mining, Algoritma Apriori, Souvenir Pasar Seni Ubud, Android, IOS, Kotlin Multiplatform Mobile, WebView, PHP, MySql.",Publish Date 04 Jan 2022,"Adiartika, Made Harry Dananjaya","JELIKU (Jurnal Elektronik Ilmu Komputer Udayana) Vol 10 No 2 (2021): JELIKU Volume 10 No 2, November 2021",3
VOCAL TONE PRECISION DETECTION USING HARMONIC PRODUCT SPECTRUM (HPS) AND K-NEAREST NEIGHBOR (KNN) CLASSIFICATION,"The progress of the digital era that is happening today, encourages rapid development in technology and science, one of which is in the field of art. Of all performing arts, the art of singing is the most complex, which requires a lot of preparation and practice. Everyone has a different type of voice. Males generally have three types of voice, namely bass, baritone, and tenor, while women generally have three types of voice, namely contralto (alto), mezzo-soprano, and soprano. However, not everyone knows what kind of voice they have. Therefore, this study will focus on classifying the human voice. In this study, the author uses the Harmonic Product Spectrum (HPS) and K-Nearest Neighbor (K-NN) algorithms. The data used is in the form of primary voice recording data obtained from 258 participants (male and female), where each person has 8 sound files, namely do, re, mi, fa, sol, la, si, and do'. saved in .wav format. From the research conducted, the test was carried out using the K-NN and K-NN methods with Hyperparameters. The results obtained in the form of accuracy of 74% and 81%, so that the Harmonic Product Spectrum (HPS) and K-Nearest Neighbor (K-NN) algorithms give good results for determining the type of human voice.",Publish Date 28 Feb 2022,"Astuti, Luh Gede","JELIKU (Jurnal Elektronik Ilmu Komputer Udayana) Vol 10 No 3 (2022): JELIKU Volume 10 No 3, February 2022",16
Music Genre Classification Using Modified K-Nearest Neighbor (MK-NN),"The genre of music is a grouping of music according to their resemblance to one another and commonly used to organize digital music. To classify music into certain genres, one can do it by listening to the music one by one manually, which will take a long time so that automatic genre assignment is needed which can be done by a number of methods, one of which is the Modified K-Nearest Neighbor. Modified K-Nearest Neighbor method is a further development of its former method called KNearest Neighbor method which adds several additional processes such as validity calculations and weight calculations to provide more information in the selection class for the testing data. Research to find the best H value shows that the H = 70% of the training data is able to produce an accuracy of 54.100% with K = 5 and the proportion ratio of test data and training data is 20:80 (fold 5). The best H value is then used for further testing, which is to compare the K-Nearest Neighbor method with the Modified K-Nearest Neighbor method using two different proportions of test data and training data and each proportion of data also tests a different K value. The results of the classification comparison of the two methods show that the Modified K-Nearest Neighbor method, with the highest accuracy of 55.300% is superior to the K-Nearest Neighbor method with the highest accuracy of 53.300%. The two highest accuracies produced in each method were obtained using K = 5 and the proportion ratio of test data and training data is 10:90 (fold 10).",Publish Date 28 Feb 2022,"Ganeswara, Putu Ryan","JELIKU (Jurnal Elektronik Ilmu Komputer Udayana) Vol 10 No 3 (2022): JELIKU Volume 10 No 3, February 2022",4
Analisis Forensik Digital pada Aplikasi Twitter di Android sebagai Bukti Digital dalam Penanganan Kasus Prostitusi Online,"At this time the use of social media from time to time has experienced rapid development, one of which is the social media twitter. Twitter social media has many benefits such as making tweets about daily activities. However, Twitter social media has a negative side in its use, one of which is online prostitution. Prostitution is an act of cyber crime that violates the rules and norms that exist in society. Therefore, to overcome these cyber crimes, the necessary action is to review online prostitution on Twitter social media. In this study, a digital forensic analysis was conducted on Twitter social media on smartphones related to acts of prostitution using the National Institute of Justice (NIJ). Based on the research conducted, digital evidence is obtained that can be accounted for by the perpetrators.",Publish Date 11 Apr 2022,"Pramartha, Cokorda Rai Adi","JELIKU (Jurnal Elektronik Ilmu Komputer Udayana) Vol 10 No 3 (2022): JELIKU Volume 10 No 3, February 2022",5
Analisis Keamanan Aplikasi Android Dengan Metode Vulnerability Assessment,"Seiring berkembangnya beragam aplikasi maka sistem Android haruslah tahan terhadap bebagai serangan malware dengan mengamati izin akses yang diberikan oleh pengguna. Penyerang dapat menggunakan kerentanan dalam aplikasi untuk mencuri berbagai informasi penting. Informasi merupakan aset penting dan berharga berupa rekaman suara, rekaman video, catatan, dll. Oleh karena itu, diperlukan suatu analisis keamanan. dari aplikasi yang digunakan dengan tes / tindakan pada tingkat keamanan aplikasi. Dalam melakukan Vulnerability test atau proses identifikasi celah keamanan pada aplikasi android dilakukan dua teknik yaitu dengan MobSF dan dengan frida. Hasil dari Analisis MobSF sangat terlihat perbedaannya antara mendownload aplikasi melalui pihak ketiga dengan mendownload aplikasi melalui Play Store. Dimana nilai hash yang didapat sangat berbeda baik dari md5, sha1, atau sha256, dari hasil tersebut dapat diketahui bahwa ada perubahan pada file yang disediakan oleh penyedia pihak ketiga. Pada security score didapatkan bahwa aplikasi yang di download melalui pihak ketiga terdapat banyak server dan aktivitas mencurigakan, sedangkan aplikasi yang terdapat di playstore terdapat 2 server yang asli. Pada size, ukuran file yang disediakan oleh pihak ketiga, ukuran file asli hanya 20.37MB sedangkan file yang di sediakan oleh pihak ketiga berukuran 61.33MB. Pada analisis menggunakan frida dilakukan proses penyerangan yaitu bypass login. Dimana pada aplikasi pihak ketiga sudah memiliki email yang telah diinputkan oleh penyedia aplikasi. Dari hasil analisis yang dilakukan maka lebih baik untuk mendownload aplikasi melalui playstore agar lebih aman. Karena sebagai pengguna awam tidak akan tahu perubahan file apa yang dilakukan dan beresiko atau tidaknya perubahan tersebut terhadap perangkat tersebut",Publish Date 11 Apr 2022,"Wikardiyan, Aditya","JELIKU (Jurnal Elektronik Ilmu Komputer Udayana) Vol 10 No 3 (2022): JELIKU Volume 10 No 3, February 2022",3
Comparison of K-Nearest Neighbor And Modified K-Nearest Neighbor With Feature Selection Mutual Information And Gini Index In Informatics Journal Classsification,"With the rapid development of informatics where thousands of informatics journals have been made, a new problem has occured where grouping these journals manually has become too difficult and expensive. The writer proposes using text classification for grouping these informatics journals. This research examines the combinations of two machine learning methods, K-Nearest Neighbors (KNN) and Modified K-Nearest Neighbors with two feature selection methods, Gini Index (GI) and Mutual Information (MI) to determine the model that produces the higherst evaluation score. The data are informatics journals stored in pdf files where they are given one of 3 designated labels: Information Retrieval, Database or Others. 252 data were collected from the websites, neliti.com and garuda.ristekbrin.go.id. This research examines and compares which of the two methods, KNN and MKNN at classifying informatics journal as well as determining which combination of parameters and feature selection that produces the best result. This research finds that the combination of method and feature selection that produces the best evaluation score is MKNN with GI as feature selection producing precision score, recall score and f1-score of 97.7%",Publish Date 04 May 2022,"Widiartha, I Made","JELIKU (Jurnal Elektronik Ilmu Komputer Udayana) Vol 10 No 3 (2022): JELIKU Volume 10 No 3, February 2022",4
Rancang Bangun Portal Lowongan Pekerjaan Berbasis Web Dengan Fitur Rekomendasi,"Tingginya tingkat pengangguran di Indonesia yang disebabkan oleh dampak pertumbuhan penduduk yang padat dan sulitnya mencari pekerjaan yang mengakibatkan pertumbuhan ekonomi tidak stabil menjadi tantangan bagi pemerintah untuk menanggulangi masalah pengangguran. Salah satu faktor yang mempengaruhi tingkat pengangguran yang tinggi adalah penyebaran informasi lowongan kerja yang kurang merata. Pelamar kerja sering kesulitan untuk mendapatkan informasi pekerjaan yang sesuai dengan kemampuan dan keterampilan yang dimiliki. Dengan dibuatnya sistem rekomendasi lowongan kerja, diharapkan dapat menyelesaikan masalah yang dialami seorang pelamar yang ingin melamar pekerjaan yang sesuai dengan kemampuannya. Dengan menggunakan algoritma euclidean distance, sistem diharapkan dapat memberikan hasil rekomendasi berdasarkan beberapa parameter yang sesuai dengan keinginan pelamar. Parameter yang dimaksudkan adalah usia, jenis kelamin, pendidikan, jurusan, gaji, keterampilan, pengalaman kerja, dan kategori pekerjaan yang diinginkan. Penelitian ini menghasilkan kesimpulan yaitu berdasarkan hasil pengujian precision recall sistem rekomendasi lowongan kerja menggunakan metode euclidean distance menghasilkan nilai precision sebesar 0,94 atau 94% dan nilai recall sebesar 0,94 atau 94%.",Publish Date 13 Jun 2022,"Rahning Putri, Luh Arida Ayu","JELIKU (Jurnal Elektronik Ilmu Komputer Udayana) Vol 10 No 3 (2022): JELIKU Volume 10 No 3, February 2022",14
Implementasi Generalized Learning Vector Quantization (GLVQ) dan Particle Swarm Optimization (PSO) Untuk Klasifikasi Kanker Payudara,"Breast cancer (BC) is the biggest cause of death from cancer every year. Delayed early detection is one the causes of the high incidence of BC. Machine learning-based classification has been widely used for automatic early detection and classifying cancer types. GLVQ was used to classify BC into benign and malignant. GLVQ has sensitivity to the initialization of a random weight vector which affects the accuracy of the results. PSO is used to optimize the initial weight vector on GLVQ, so that the optimal initial weight vector is produced. The data processing stage includes handling outliers with Winsorizing method, z-score normalization, and dimensionality reduction using PCA. Changes in the parameters cognition learning rate, social learning rate, and inertia in PSO affect the results of the optimization of the weight vector which is indicated by the average value of the resulting fitness. The combination of cognition learning rate=2,4, social learning rate=2,1, and inertia=0,6 produces the highest average fitness value of 0,91868. Changes in the parameters learning rate and number of prototype per class in GLVQ affect the level of accuracy and error rate of the resulting breast cancer classification results. The combination of learning rate=0,1, number of prototype per class=5, maximum epoch of 100, and minimum error tolerance of 0,0000001 produces the highest average accuracy value of 0,956044. PSO-GLVQ performance provides higher accuracy, recall, and F2-Score values than GLVQ.",Publish Date 31 May 2022,"Cahyadi Putra, I Gusti Ngurah Anom","JELIKU (Jurnal Elektronik Ilmu Komputer Udayana) Vol 10 No 4 (2022): JELIKU Volume 10 No 4, May 2022",2
