Judul,Abstrak,Tanggal,Author,Jurnal,cluster
RANCANG BANGUN WEBSITE ARSIP AKTIVITAS HARIAN PEGAWAI BADAN KEPEGAWAIAN DAN PENGEMBANGAN SUMBER DAYA MANUSIA KABUPATEN BADUNG,the development of information technology has a very rapid impact on the development of human activities one example is the application of information technology in the form of information systems at the human resources development and human resources agency bkpsdm of badung regency this information system helps employees in bkpsdm especially in the data field to help their work but one of the problems that occurs in bkpsdm in the data field is that employees are still searching for employee map numbers still manually by asking the employee nip and looking for employee map numbers by looking at the hardcopy that is already in the closet so that the time needed to find the employee map number is long enough so that the time to do the other tasks is quite drained from these problems the author makes a solution that is by making an information system that can dance the staff map number by simply entering the nip on the system named e-staffing archive this information system can also import personnel data with the xlsx file format and export personnel data to file xls format this system is built using the codeigniter ci framework with a php backend and mysql database,Publish Date 09 Aug 2019,"Suwitra, I Made Pradnyanandana Suwitra","JELIKU (Jurnal Elektronik Ilmu Komputer Udayana) Vol 8 No 1 (2019): JELIKU Volume 8 No 1, Agustus 2019",12
Rancang Sistem Notifikasi Dan Pelaporan Iranian Optical Distribution Purpose Berbasis Mobile,pt telkom indonesia badan usaha milik negara bumn sedia layan telekomunikasi jaring besar indonesia pt telkom indonesia awal buah usaha swasta sedia layan pos telegram data akses management daman rupa salah satu divisi tugas purifikasi data jaring updating data siska updating gambar skematik muncul odp iranian optical distribution purpose odp tidak muncul jadi salah komunikasi tim lapang divisi daman data odp terkadang sesuai data ada pusat masalah sebut tulis buat buah aplikasi mobile tugas beri notifikasi lapor hasil kerja kata kunci odp aplikasi mobile,Publish Date 09 Aug 2019,"Santi Astawa, I Gede","JELIKU (Jurnal Elektronik Ilmu Komputer Udayana) Vol 8 No 1 (2019): JELIKU Volume 8 No 1, Agustus 2019",11
Pengembangan Aplikasi Front-End Pemeliharaan Inventaris Pegawai (Studi Kasus : Bappeda Kabupaten Badung),dewasa kembang teknologi jadi sangat pesat ini semua kerja integrasi satu lain cara cepat mudah guna teknologi informasi baik cepat mudah kerja manusia ada manfaat efisien badan rencana bangun daerah bappeda kabupaten badung salah satu instansi besar dasar manfaat maju teknologi untuk bantu mudah selesai kerja pegawai inventaris milik bappeda beri biaya pagu untuk pelihara tahun misal inventaris kendara motor alat komputer juga tanam hias lihat aspek kelola data data inventaris sebut laku cara manual seringkali jadi keliru hadap beri jumlah pagu untuk inventaris dalam manajemen inventaris barang sebut terap teknologi upa aplikasi karena nya tulis coba kembang aplikasi harap mudah kelola data manajemen inventaris pegawai milik bappeda sebut pegawai laku inputan untuk inventaris mereka milik juga urai biaya pelihara inventaris sebut dari data telah diinput dapat tampil pantau inventaris biaya awat lebih biaya pagu yang mesti ini biaya pelihara untuk masing-masing inventaris dapat guna cara optimal,Publish Date 09 Aug 2019,"Sutanegara, Made Dimas Dwi","JELIKU (Jurnal Elektronik Ilmu Komputer Udayana) Vol 8 No 1 (2019): JELIKU Volume 8 No 1, Agustus 2019",14
Rancang Bangun Website Arsip Aktivitas Harian Pegawai Badan Kepegawaian Dan Pengembangan Sumber Daya Manusia Kabupaten Badung,information technology currently has a very important take on the development of human activities for example the application of information technology in the form of management information systems at the human resources development and empowerment agency bkpsdm of badung regency this information system helps employees in bkpsdm especially in the data field to help their work but one of the problems that occurs in bkpsdm in the data field is that employees are still searching for employee map numbers still manually by asking the employee nip and looking for employee map numbers by looking at the hardcopy that is already in the closet so that the time needed to find the employee map number is long enough so that the time to do the other tasks is quite drained from these problems the author makes a solution that is by making an information system that can find the employee map number by simply entering the nip on the system named e-staffing archive this information system can also import personnel data with the xlsx file format and export personnel data to file xls format this system is built using the codeigniter ci framework with a php backend and mysql database,Publish Date 09 Aug 2019,"Adi Pramartha, Cokorda Rai","JELIKU (Jurnal Elektronik Ilmu Komputer Udayana) Vol 8 No 1 (2019): JELIKU Volume 8 No 1, Agustus 2019",12
Perancangan Sistem Chick Maintenance Cycle Menggunakan ERP Pada PT Charoen Pockphand,the development of the world of computers and information technology has been very rapid in recent years a company needs an information system that can accommodate various needs of the company in carrying out business processes with the application of information systems to companies business processes can run more smoothly and faster pt charoen pockphand indonesia wants to create a new system based on an existing system using an erp or enterprises planning resource erp was chosen because it has a wide operating area of functionality namely marketing and sales supply chain management accounts and finance and human resources,Publish Date 09 Aug 2019,"dwipayana, made nanda","JELIKU (Jurnal Elektronik Ilmu Komputer Udayana) Vol 8 No 1 (2019): JELIKU Volume 8 No 1, Agustus 2019",13
Rancang Bangun Sistem Back End Pada Sistem Convert Data Laporan Stasiun Pengamatan MKG Di Sub Bagian Manajemen Data BBMKG Wilayah III Denpasar,balai balai besar meteorologi klimatologi geofisika wilayah iii rupa lembaga perintah non departemen lpnd pimpin kepala badan balai besar meteorologi klimatologi geofisika wilayah iii tugas taung 43 stasiun sebar indonesia barat jawa timur indonesia tengah timur hal sedia data informasi bidang meteorologi klimatologi geofisika balai letak jalan raya tuban kuta kabupaten badung bal balai milik 3 bidang salah satu bidang data informasi bidang data informasi salah satu sub bidang manajemen data sub bidang manajemen data milik masalah kait penginputan data lapor hasil meiliki format beda beda stasiun tidak sesuai atur kepala badan meteorologi klimatologi geofisika nomor 4 tahun 2016 kelola data iklim lingkung badan meteorologi klimatologi geofisika proses penginputan sebut laku cara manual untuk buat system mampu mengconvert data lapor hasil bulan jadi lapor tahun sistem harap bantu kerja pegawai hal laku input data lapor hasil amat 43 stasiun yang di naung balai besar meteorologi klimatologi geofisika wilayah iii kata kunci bbmkg convert data excel manajemen data sistem,Publish Date 09 Aug 2019,"Ari Mogi, I Komang","JELIKU (Jurnal Elektronik Ilmu Komputer Udayana) Vol 8 No 1 (2019): JELIKU Volume 8 No 1, Agustus 2019",7
Rancang Bangun Sistem Kuesioner (Studi Kasus: SMA Negeri 2 Semarapura),rancang bangun kuesioner tuju untuk evaluasi hadap program kerja kerja guru pegawai fasilitas sekolah sistem web buat cara dinamis pihak sekolah buat tanya sesuai isu sekolah untuk implementasi guna html css javascript database mysql metode kembang guna rapid aplication development rad fase rencana syarat fase ancang fase laksana hasil uji guna black box tunjuk hasil uji menu fitur aplikasi halaman utama terima kerja dengan mesti,Publish Date 09 Aug 2019,"Putra, I Gede Ari","JELIKU (Jurnal Elektronik Ilmu Komputer Udayana) Vol 8 No 1 (2019): JELIKU Volume 8 No 1, Agustus 2019",3
Rancang Bangun Sistem Informasi Manajemen Arsip Surat,arsip rupa pusat ingat tiap organisasi instansi olah kurang baik akibat pengaruh reputasi organisasi instansi sebut salah satu guna arsip untuk manajemen document penting surat masuk surat keluar sistem informasi arsip surat masuk keluar kembang dasar metode waterfall harap mudah instansi perintah kantor perbekel desa pecut kelod camat denpasar barat kota denpasar jalan cara optimal layan masyarakat cepat tepat,Publish Date 09 Aug 2019,"Eka Karyawati, A. A. Istri Ngurah","JELIKU (Jurnal Elektronik Ilmu Komputer Udayana) Vol 8 No 1 (2019): JELIKU Volume 8 No 1, Agustus 2019",7
Perancangan Sistem Pengaturan Suhu Ruangan Otomatis Berbasis Mikrokontroler,a server room is a room that is used to store servers network communication devices such as routers and switches and other operational related devices server rooms that have high temperatures and humidity will affect the performance of all devices so the temperature and humidity of the server room must be maintained so that the device is not easily damaged so from that the company needs to implement a standard to protect the performance of the devices stored in it to overcome this problem a device was developed that can automatically control and monitor temperature and humidity the system will be built using temperature and humidity sensors that are used to monitor the temperature of the room the condition of the room temperature and humidity of the room will be displayed through a website that can be accessed through the internet network,Publish Date 09 Aug 2019,"bratha, dede khausa bayu","JELIKU (Jurnal Elektronik Ilmu Komputer Udayana) Vol 8 No 1 (2019): JELIKU Volume 8 No 1, Agustus 2019",2
INDEPENDENT COMPONENT ANALYSIS (ICA) DAN SPARSE COMPONENT ANALYSIS (SCA) DALAM PEMISAHAN VOKAL DAN INSTRUMEN PADA SENI GEGUNTANGAN,geguntangan pesantian upacara agama iring gamelan indra dengar manusia cenderung milik batas sebab semua vokal campur gamelan dengar jelas karena perlu sistem guna untuk pisah vokal gamelan geguntangan pisah sumber suara kategori blind source separation bss sebut blind signal separation arti sumber kenal algoritma guna untuk tangan bss algoritma independent component analysis ica sparse component analysis sca fokus pisah sinyal suara file suara format wav algoritma sca ica guna untuk proses pisah suara parameter nilai guna mean square error mse signalto interference ratio sir hasil simulasi tunjuk hasil hitung mse sir dengan guna mixing matriks 0 3816 0 8678 0 8534 -0 5853 dapat untuk metode ica nilai mse besar 4 169380402433175 x 10-6 untuk instrumen 2 884749383815846 x 10-5 untuk vokal dapat nilai sir besar 53 79928479270223 untuk instrumen 45 39891910741724 untuk vokal lanjut untuk metode sca nilai mse besar 3 382207103335018 x 10-5 untuk instrumen 3 099942460987607 x 10-5 untuk vokal dapat nilai sir besar 44 707998026869014 untuk instrumen 45 08646367168143 untuk vokal,Publish Date 21 Sep 2019,"Widiartha, I Made","JELIKU (Jurnal Elektronik Ilmu Komputer Udayana) Vol 8 No 1 (2019): JELIKU Volume 8 No 1, Agustus 2019",3
Klasifikasi Penyakit Kanker Payudara Menggunakan Jaringan Syaraf Tiruan dan Seleksi Fitur,breast cancer is still one of the leading causes of death in the world prevention can be done if the cancer can be recognized early on whether the cancer is malignant or benign in this study a comparison of malignant and benign cancer classifications was performed using two artificial neural network methods which are the feed-forward backpropagation method and the elman recurrent neural network method before and after the feature selection of the data the result of the study produced that feed-forward backpropagation method using 2 hidden layers is better after the feature selection was performed on the data with an accuracy value of 99 26,Publish Date 01 Dec 2019,"Wijaya, Wahyu Septian","JELIKU (Jurnal Elektronik Ilmu Komputer Udayana) Vol 8 No 2 (2019): Jeliku Volume 8 No 2, November 2019",8
Segmentation of Certificate With Connected Component Labeling Method,certificate is one of the documents that can be used as evidence of ownership or an event for example when certificate used as requirement to participate in an event if a document is made as a requirement of course the file verification process will be done seeing the time optimization problem when verifying the file the authors carry out research by segmenting important data contained in a certificate as an initial step in the development of an automatic document verification system the segmentation process carried out in this study uses the connected component labeling method in determining the area to be segmented and automatic cropping to cut the results of the segmentation process by using these two methods obtained an accuracy of 60 with a total of 15 pieces of test data,Publish Date 08 Jan 2020,"Adi Pramartha, Cokorda Rai","JELIKU (Jurnal Elektronik Ilmu Komputer Udayana) Vol 8 No 2 (2019): Jeliku Volume 8 No 2, November 2019",10
Syllabification of Balinese Words Using the Syllabification Algorithm,abstract this research discusses the syllabification of balinese words the syllabification of balinese words is necessary in determining padalingsa in pupuh in order to be able to develop the application of technology in the field of pupuh literary a system that can automatically find the correct division of a balinese word into syllabels is required several studies have been conducted on the syllabification spanish and sinhala language using rule-based approach both of the studies achieved good accuracy score thus in this research we apply the rule-based syllabification approach on balinese words the data used in this study were 257 balinese words in which the system managed to correctly vide the word as many as 244 and obtained an accuracy score of 94 94 keywords syllabification algorithm word balinese word syllabification rule-based,Publish Date 08 Jan 2020,"Putrawan, Putu Bagus Kresna","JELIKU (Jurnal Elektronik Ilmu Komputer Udayana) Vol 8 No 2 (2019): Jeliku Volume 8 No 2, November 2019",6
Akuisisi Bukti Media Sosial Digital LINE Menggunakan Metode National Institute of Justice (NIJ),nowadays the use of social media has developed very rapidly over time with very easy to use and also higher security than ordinary messaging services making one of the factors of social media is very often used in today s world but behind it all social media such as line is very vulnerable to become one of the crime facilities one of which is cyberbullying to follow up on the cyberbullying activity a forensic cellphone needs to be carried out to find evidence which is then useful to send to court this study uses the line application as cyberbullying crime media as well as using the national institute of justice nij method the national institute of justice nij method has five basic stages namely preparation collection examination analysis and reporting in this study using the mobiledit forensic tool and db browser for sqlite it is hoped that the research carried out can help in solving cyberbullying on social media line on mobile forensics,Publish Date 08 Jan 2020,"Muliantara, Agus","JELIKU (Jurnal Elektronik Ilmu Komputer Udayana) Vol 8 No 2 (2019): Jeliku Volume 8 No 2, November 2019",5
Tempo Tracking pada Transkrip Guru Ding Dong menggunakan Metode Connected Component Labeling (CCL),music notation is a system of writing musical expressions as outlined in the form of symbols in the form of numbers or blocks music notation is used to document the composer s work in the form of songs so that it can be used by the public in balinese culture there is also a musical notation called guru ding s notation this study discusses the segmentation of guru ding transcript to determine the tempo of each notation using the connected component labeling method and the rule-based method ccl algorithm applies graph theory where all pixels in an area that have a relationship with obeying the rules of pixel proximity will become a new image the image that can be processed by the ccl algorithm is a binary image in addition this study also uses the image preprocessing method for initial data processing namely grayscaling and binarization the system built for research uses the matlab 2017b application the results of the test resulted in an accuracy of the successful identification of characters and the tempo of each notation of 82 this is influenced by the preprocessing process where there is a lot of noise in the image,Publish Date 08 Jan 2020,"Artawan, Komang Nova","JELIKU (Jurnal Elektronik Ilmu Komputer Udayana) Vol 8 No 2 (2019): Jeliku Volume 8 No 2, November 2019",10
Pengembangan Pemodelan Ontologi Semantik dalam Representasi Pengetahuan Instrumen Gamelan Bali,indonesia has many types of cultural and artistic heritage which one is balinese gamelan knowledge of balinese gamelan still tends to be less explicitly collected this result the cultural heritage knowledge especially the balinese gamelan challenging to be learned by the young and future balinese generation therefore the knowledge of balinese gamelan information should be documented well especially in the digital form in this research we develop an ontology for balinese cultural heritage specifically the gamelan bal this ontology can be used to capture document and represent knowledge surrounds the balinese gamelan domain the construction of the ontology model was carried out using the methontology methodology the gamelan ontology has 112 classes 31 datatype properties 53 object properties and 289 instances further research needs to carry out in order to evaluate and improve the quality of ontology and follow-up by the implementation into a semantic web-based application,Publish Date 08 Jan 2020,"Gede Suhartana, I Ketut","JELIKU (Jurnal Elektronik Ilmu Komputer Udayana) Vol 8 No 2 (2019): Jeliku Volume 8 No 2, November 2019",15
Customer Segmentation Using RFM Model,at the time of the asean economic community mea indonesia was selected by several companies from other countries to sell its products including overseas paint companies therefore the increasingly fierce market competition business is unlikely to focus solely on products sold but it is also important to pay attention to the process of managing customer relationships with retailers segmentation is an early process that knows which customers can be sustained in segmentation customers who have certain similarities will be grouped into one customer segmentation is a model built in grouping customers according to certain standards to be used as a variable grouping customers will be the same group if they have certain similarities while different groups or segments are customers who have different characteristics,Publish Date 08 Jan 2020,"Prasetya, Ketut Yogi","JELIKU (Jurnal Elektronik Ilmu Komputer Udayana) Vol 8 No 2 (2019): Jeliku Volume 8 No 2, November 2019",10
Building TariPedia App as A Typical Balinese Performance Encyclopedia on Mobile Device Platform,indonesia is a country with a variety of cultures and arts traditional art dance is one of indonesia s arts which is one of the important aspects in supporting indonesian culture and even tourism traditional dance has a special attraction to be enjoyed while staying in the midst of rapid development therefore the writer makes a market application that connects the studios dance groups and dancers with traditional dancer tenants taripedia makes it easy for studio owners service providers and event organizers to market their services so that they can be more easily reached by the public and can increase sales of their services with the payment feature through the application therefore by developing taripedia with prototyping method and java language in its development taripedia will continue facilitates the community especially in the fields of traditional dance and at the same time modernizing regional arts,Publish Date 08 Jan 2020,"Dharma Wibawa, I Made Bayu","JELIKU (Jurnal Elektronik Ilmu Komputer Udayana) Vol 8 No 2 (2019): Jeliku Volume 8 No 2, November 2019",0
Designing a Computer Network in Building a Smart School with Case Study of SMA Negeri 1 Kediri,smart school is a technology-based school concept used in the teaching and learning process in the classroom the use of educational technology includes an integrated system that assists the educational community in carrying out their respective functions with the aim of developing the potential of students the use of technology in the field of education is expected to help and facilitate students and schools in conducting learning so that technology is able to facilitate and solve problems in learning in building smart schools it is also necessary to design technology developed in technology the concept of network development that will be used is to use the top-down method and the topology used is to use ring topology and star topology with the development of smart schools it is expected that education using technology will continue to develop,Publish Date 08 Jan 2020,"Gede Dwidasmara, Ida Bagus","JELIKU (Jurnal Elektronik Ilmu Komputer Udayana) Vol 8 No 2 (2019): Jeliku Volume 8 No 2, November 2019",12
Implementation of the CBR (Case Based Reasoning) Method in Cases of Cesarean section,cbr case based reasoning method is a reasoning method that uses old knowledge to overcome new problems cbr will provide solutions to new cases by looking at old cases that are closest to new cases one case that can use the cbr method is a case of cesarean section because there are several factors that affect cesarean section as well as features in the system including age number of pregnancies time of delivery blood pressure and heart status so that not everyone can do surgery cesar in this study a system was used to determine whether a patient could have a cesarean section or not by using the cbr method and calculate similarity using naive bayes the percentage correlation value of each feature is sought using spss because each feature has a different effect on the results the number of cesarean section data was 80 data in this study were divided into 70 training data 56 and 30 testing data 24 where the new case data will be compared with the old case data in the database and then the similarity criteria are calculated based on the existing formula the results of testing of 24 data testing there are 5 data whose results are incompatible and 19 data whose results are in accordance with the data before it is shared so that the accuracy of the cesarean section with the cbr method using nayve bayes is 79,Publish Date 08 Jan 2020,"Sri Devi, Ni Komang","JELIKU (Jurnal Elektronik Ilmu Komputer Udayana) Vol 8 No 2 (2019): Jeliku Volume 8 No 2, November 2019",19
Comparison of Use of Music Content (Tempo) and User Context (Mood) Features On Classification of Music Genre,the development of technology in the current era in the field of multimedia music is not just entertainment or pleasure nowadays online music growth is greatly increasing namely music can be classified by genre the music genre is the grouping of music according to their resemblance to each other in previous studies the system was built with naive bayes classifier which is useful for predicting songs based on the lyrics of the song in our study we used a dataset that was divided into several genera namely blues electronic r b christian hip hop rap rock country jazz ska dance pop and soul which obtained the accuracy of music content of 45 while for context users get an accuracy of 60 keywords genre naive bayes music content user context,Publish Date 08 Jan 2020,"Bayu Atmaja Darmawan, I Dewa Made","JELIKU (Jurnal Elektronik Ilmu Komputer Udayana) Vol 8 No 2 (2019): Jeliku Volume 8 No 2, November 2019",16
Pengembangan Rekomender Sistem Layanan Kesehatan Terintegrasi E-Commerce,kembang rekomender sistem layan sehat tuju untuk bantu masyarakat tempat layan sehat baik untuk kunjung pilih tempat layan sehat dasar kriteria kualitas layan jarak tempuh guna tempat layan rating tempat layan masalah hadap bagaimana tentu tempat layan sehat baik kriteria sifat subjektif tidak dengan cepat sistem rekomendasi layan sehat bangun guna metode f-ahp fuzzy analytical hierarchy process kembang metode ahp analytical hierarchy process atas kriteria sifat subjektif tidak dengan cepat sistem rekomendasi layan sehat terap perangkat mobile mudah guna untuk dapat rekomendasi tempat layan sehat dasar kriteria kualitas layan jarak tempuh rating tempat layan cari informasi tempat layan sehat dengan tangan masalah mesan nomor antri bayar teliti hasil buah sistem rekomendasi layan sehat bas mobile guna metode fuzzy ahp maksud sistem rekomendasi tempat layan sehat bas mobile untuk mudah guna aplikasi cari informasi tempat layan sehat tentu tempat layan sehat baik rekomendasi sistem,Publish Date 14 Jan 2020,"Budiastawa, I Dewa Gede","JELIKU (Jurnal Elektronik Ilmu Komputer Udayana) Vol 8 No 2 (2019): Jeliku Volume 8 No 2, November 2019",7
Perbandingan Jenis TF terhadap Hasil Evaluasi Information Retrieval,buah sistem temu kembali salah satu cara untuk cari antara query dokumen guna term frequency inverse document frequency tf-idf tf umum guna langsung guna jumlah term frequency banyak jenis tf yang kombinasi idf teliti akan kombinasi 4 jenis tf natural tf normalization max tf logaritma tf boolean tf tuju untuk cari jenis tf yang baik kombinasi idf hasil teliti tunjuk logaritma tf yang baik dengan nilai f-measure besar 0 00662 keywords tf-idf natural tf normalization tf logaritma tf boolean tf,Publish Date 16 Jan 2021,"Santiyasa, I Wayan","JELIKU (Jurnal Elektronik Ilmu Komputer Udayana) Vol 8 No 2 (2019): Jeliku Volume 8 No 2, November 2019",11
